timestamp,storename,address_original,address_normalize[0],address_normalize[1],最終更新日,url,開設者種別,開設者名,管理者名,歯科一般領域一覧,歯科口腔外科領域一覧,小児歯科領域一覧,矯正歯科領域一覧,施設状況一覧,対応可能ﾅ麻酔治療一覧,在宅医療,連携ﾉ有無,歯科医師(総数|常勤|非常勤),歯科技工士(総数|常勤|非常勤),歯科助手(総数|常勤|非常勤),歯科衛生士(総数|常勤|非常勤),前年度1日平均外来患者数,緯度,経度,page
2023/8/26,医療法人社団日坂会九段下駅前歯科ｸﾘﾆｯｸ,千代田区九段南1-6-5九段会館ﾃﾗｽb1f,東京都千代田区九段南一丁目6-59,段会館ﾃﾗｽb1f,2022年12月27日,https://www.himawari.metro.tokyo.jp/qq13/qqport/tomintop/detail/fk1102.php?sisetuid=3136400115&kinouid=fk9024,医療法人,日坂充宏,齋藤達郎,"['歯科領域の一次診療', '口腔ケア', 'う蝕（虫歯）治療', '予防歯科の実施またはう蝕予防処置（フッ素塗布、シーラント）', '欠損補綴（入れ歯）', '歯ぎしり', '歯周病治療', '金属アレルギー患者の歯科診療', '重篤な歯周病の治療', 'フッ化物洗口の指導', '歯周病予防処置', '']","['埋伏歯抜歯', 'インプラント', '顎関節症治療', '']","['一般の小児歯科治療', 'フッ素塗布']","['成人の歯科矯正治療', '']","['通常の車椅子の患者がチェアサイドまで入れる環境がある', '聴覚障害者への配慮（筆談など文字による対応）', '多機能トイレが設置されている', '開口器がある', '診療室のユニットが間仕切りで区切られている', '近くにコインパーキングがある（障害者の利用が困難なものを除く）']",na,"['訪問歯科診療', '']",na,2.0|2|-,na,2.0|2|-,1.0|-|1.0,na,35.694197,139.751402,1
2023/8/26,医療法人社団立誠会岡村ﾃﾞﾝﾀﾙｸﾘﾆｯｸ,千代田区神田神保町3-2ｻﾝﾗｲﾄﾋﾞﾙ2f,東京都千代田区神田神保町三丁目2,ｻﾝﾗｲﾄﾋﾞﾙ2f,2022年12月22日,https://www.himawari.metro.tokyo.jp/qq13/qqport/tomintop/detail/fk1102.php?sisetuid=3136405680&kinouid=fk9024,医療法人,医療法人社団立誠会,岡村立国,"['歯科領域の一次診療', '口腔ケア', '摂食機能障害の治療', '予防歯科の実施またはう蝕予防処置（フッ素塗布、シーラント）', 'う蝕（虫歯）治療', '口臭症の治療', '欠損補綴（入れ歯）', '歯ぎしり', '歯周病治療', '禁煙支援', '重篤な歯周病の治療', '居宅療養管理指導の実施', '歯周病予防処置', '']","['埋伏歯抜歯', '歯牙移植術', '顎関節症治療', '歯周組織再生誘導手術', 'インプラント', '口腔外科関連小手術']","['一般の小児歯科治療', 'ＭＴＭ（ＭｉｎｏｒＴｏｏｔｈＭｏｖｅｍｅｎｔ）術', '咬合誘導', 'フッ素塗布']","['若年者の歯科矯正治療', '成人の歯科矯正治療']","['聴覚障害者への配慮（筆談など文字による対応）', '']",na,na,"['病院との連携', '歯科診療所との連携']",3.0|1|2.0,na,2.0|1|1.0,5.0|3|2.0,na,35.696086,139.754513,1
2023/8/26,ﾄｼﾃﾞﾝﾀﾙｸﾘﾆｯｸ,千代田区神田神保町2-9神田神保町ﾒﾃﾞｨｶﾙﾓｰﾙ2階,東京都千代田区神田神保町二丁目9,神田神保町ﾒﾃﾞｨｶﾙﾓｰﾙ2階,2022年12月22日,https://www.himawari.metro.tokyo.jp/qq13/qqport/tomintop/detail/fk1102.php?sisetuid=3136402780&kinouid=fk9024,個人,寺田利久,寺田利久,"['歯科領域の一次診療', '口腔ケア', 'う蝕（虫歯）治療', '予防歯科の実施またはう蝕予防処置（フッ素塗布、シーラント）', '欠損補綴（入れ歯）', '口臭症の治療', '歯周病治療', '歯ぎしり', '重篤な歯周病の治療', '金属アレルギー患者の歯科診療', '歯周病予防処置', '']","['埋伏歯抜歯', 'インプラント', '顎関節症治療', '歯牙移植術', '口唇・舌・口腔粘膜の炎症又は外傷の治療', '口腔外科関連小手術']","['一般の小児歯科治療', 'フッ素塗布']",na,na,na,na,"['病院との連携', '歯科診療所との連携', '医科診療所との連携', '薬局との連携']",2.0|2|-,-|-|-,3.0|2|1.0,2.0|2|-,na,35.695336,139.755874,1
2023/8/26,医療法人社団ｽﾀﾃﾞﾝｽﾀｰﾃﾞﾝﾀﾙｸﾘﾆｯｸ,千代田区九段北1-3-3九段下東急真ｻｸﾗﾋﾞﾙ2f,東京都千代田区九段北一丁目3-39,段下東急真ｻｸﾗﾋﾞﾙ2f,2020年7月13日,https://www.himawari.metro.tokyo.jp/qq13/qqport/tomintop/detail/fk1102.php?sisetuid=3136499951&kinouid=fk9024,医療法人,医療法人社団ｽﾀﾃﾞﾝ,田中和之,"['歯科領域の一次診療', '予防歯科の実施またはう蝕予防処置（フッ素塗布、シーラント）', 'う蝕（虫歯）治療', '歯ぎしり', '歯周病予防処置', '金属アレルギー患者の歯科診療', '口腔ケア', '']","['インプラント', '']","['ＭＴＭ（ＭｉｎｏｒＴｏｏｔｈＭｏｖｅｍｅｎｔ）術', '']",na,na,na,na,na,4.0|2|2.0,na,4.0|4|-,4.0|4|-,na,35.695836,139.751513,1
2023/8/26,掛田歯科医院,千代田区九段北1-4-5東英九段ﾋﾞﾙ4f,東京都千代田区九段北一丁目4-5,東英九段ﾋﾞﾙ4f,2023年3月3日,https://www.himawari.metro.tokyo.jp/qq13/qqport/tomintop/detail/fk1102.php?sisetuid=3130123940&kinouid=fk9024,個人,掛田朗,掛田朗,"['歯科領域の一次診療', '口腔ケア', 'う蝕（虫歯）治療', '予防歯科の実施またはう蝕予防処置（フッ素塗布、シーラント）', '欠損補綴（入れ歯）', '口臭症の治療', '歯周病治療', '歯ぎしり', '重篤な歯周病の治療', '金属アレルギー患者の歯科診療', '歯周病予防処置', '']","['埋伏歯抜歯', '歯周組織再生誘導手術', '顎関節症治療', '口腔外科関連小手術', '口唇・舌・口腔粘膜の炎症又は外傷の治療', '舌痛症治療', 'インプラント', '口腔乾燥症治療', '歯牙移植術', '']","['一般の小児歯科治療', 'ＭＴＭ（ＭｉｎｏｒＴｏｏｔｈＭｏｖｅｍｅｎｔ）術', '咬合誘導', 'フッ素塗布']","['若年者の歯科矯正治療', '成人の歯科矯正治療']","['聴覚障害者への配慮（筆談など文字による対応）', '']",na,na,na,2.0|2|-,na,1.0|1|-,na,10,35.696447,139.751402,1
